{
  "entries": [
    {
      "run": 1,
      "ticket": "KO-7",
      "pr_url": "https://github.com/OWNER/REPO/pull/7",
      "at": 1750000000000,
      "kind": "round",
      "source": "loop",
      "text": "Round 1: ADDRESS operator_note event 2"
    },
    {
      "run": 4,
      "ticket": "KO-10",
      "pr_url": "https://github.com/OWNER/REPO/pull/9",
      "at": 1750000000000,
      "kind": "park",
      "source": "factory",
      "text": "a thread needs a human's answer; nothing was posted on it"
    },
    {
      "at": 1750000000000,
      "run": null,
      "ticket": null,
      "pr_url": null,
      "kind": "intervention",
      "source": "factory",
      "action": "migrate",
      "tone": "neutral",
      "text": "store schema 62 (migrated from 0 at 2025-06-15T15:06:40+00:00 by BUILD, pid 1, COMMAND)",
      "schema_to": 62,
      "schema_from": 0,
      "project": "/repo",
      "cleared": null,
      "waited_ms": null
    },
    {
      "run": 3,
      "ticket": "KO-9",
      "pr_url": null,
      "at": 1750000000000,
      "kind": "intervention",
      "source": "operator",
      "text": "human approve: go",
      "cleared": null,
      "waited_ms": null
    },
    {
      "run": 5,
      "ticket": "KO-11",
      "pr_url": null,
      "at": 1750000000000,
      "kind": "failure",
      "source": "factory",
      "text": "swept: no heartbeat for 20 minutes",
      "failure_kind": "swept"
    }
  ],
  "active_outages": [],
  "since": 0,
  "limit": 200
}
